{
  "$schema": "corpus.schema.json",
  "schemaVersion": 1,
  "updated": "2026-09-05",
  "provenance": {
    "origin": "authored",
    "rule": "Every sample in this file is authored here and materialised by the tool under test. Nothing is downloaded and no document file is committed. That is not convenience: ADR 0013 gives each format its own rights record, and this repository's practice, recorded across the similarity review log in docs/ip/pdf-approved-sources.md, is that fixtures are generated in the tree rather than taken from anywhere. A corpus of documents somebody else wrote would be the one part of this test suite whose provenance nobody could state.",
    "external": "A registered, digest-pinned fetch path exists for the day somebody decides an outside document may be used: tests/corpus/external-sources.json. It ships with no approved row, so it fetches nothing.",
    "cost": "The cost is real and worth naming. These documents were written by the same project that wrote the codecs, so they exercise what this component thought of. They are evidence about round-trip fidelity and about the command contract. They are not evidence that a document produced by Word, LibreOffice or a browser reads correctly."
  },
  "assets": [
    {
      "id": "square",
      "description": "A small PNG, produced by rendering a one-character document at a fixed page box. The tool draws its own fixture, so no image file is committed and the asset is reproducible from this row alone.",
      "recipe": {
        "text": "X",
        "sourceFormat": "markdown",
        "pageSize": "40x40",
        "marginPoints": 4
      }
    }
  ],
  "samples": [
    {
      "id": "plain",
      "title": "Plain paragraphs",
      "exercises": [
        "paragraph"
      ],
      "lines": [
        "One paragraph, and nothing to it.",
        "A second paragraph.",
        "A third."
      ],
      "operations": [],
      "notes": "The floor. Every format must carry unstyled prose without losing a character, so a difference here is never a documented limitation."
    },
    {
      "id": "emphasis",
      "title": "Inline emphasis",
      "exercises": [
        "bold",
        "italic",
        "underline",
        "strikethrough"
      ],
      "lines": [
        "Bold italic underline struck normal."
      ],
      "operations": [
        "inline:0:0-4:bold=on",
        "inline:0:5-11:italic=on",
        "inline:0:12-21:underline=on",
        "inline:0:22-28:strike=on"
      ],
      "notes": "Four toggles, each on its own word and each separated from the next by a space. The separators are load-bearing: a reader that mis-attributes the space between two runs is caught here rather than in a run-boundary unit test nobody wrote."
    },
    {
      "id": "typography",
      "title": "Family, size and capitalization",
      "exercises": [
        "fontFamily",
        "fontSize",
        "capitalization"
      ],
      "lines": [
        "Family and size and caps here."
      ],
      "operations": [
        "inline:0:0-6:font=monospace",
        "inline:0:11-15:size=18",
        "inline:0:20-24:caps=all"
      ],
      "notes": "Capitalization is display-only in the model, so a format with no way to say it drops the property rather than rewriting the text."
    },
    {
      "id": "colour",
      "title": "Foreground and highlight",
      "exercises": [
        "foreground",
        "background"
      ],
      "lines": [
        "Foreground and highlight."
      ],
      "operations": [
        "inline:0:0-10:color=#B71C1C",
        "inline:0:15-24:highlight=#FFF59D"
      ],
      "notes": "Colour is where the roadmap's position is easiest to see: Markdown has no way to express either, and says so in a diagnostic instead of pretending."
    },
    {
      "id": "links",
      "title": "Permitted link schemes",
      "exercises": [
        "link"
      ],
      "lines": [
        "Absolute link and mail link and plain text."
      ],
      "operations": [
        "inline:0:9-13:link=https://example.org/",
        "inline:0:23-27:link=mailto:someone@example.org"
      ],
      "notes": "The two schemes every codec here allows. example.org is reserved by RFC 2606, so nothing in this corpus names a host anybody owns. The sample could not be written until the edit language could express a URL at all: a PROPS value used to be cut at its first colon, so `link=https://example.org/` stored the href `https`, which every writer then refused as a relative target - a plausible diagnostic about a value nobody had written."
    },
    {
      "id": "links-rejected",
      "title": "A link scheme the writers should refuse",
      "exercises": [
        "link",
        "diagnostics"
      ],
      "lines": [
        "Bad link here."
      ],
      "operations": [
        "inline:0:0-3:link=javascript:alert(1)"
      ],
      "mustNotAppear": [
        {
          "text": "javascript:",
          "emittedBy": [],
          "state": "accepted",
          "why": "No writer emits it. Every codec applies its own reader's allow-list on the way out, degrades the run to plain text and reports it, so the refused scheme reaches no document. The entry stays because the check is the only thing that can see this: every reader refuses the same schemes, so a document that wrote the link and one that dropped it read back identically and no round trip can tell them apart.",
          "reviewer": "Claude Opus 5, on the write-side URI policy pass",
          "decided": "2026-09-05"
        }
      ],
      "notes": "Not a fidelity sample, and the round trip cannot see what it is for: every reader here refuses the scheme too, so a document that kept the link and one that dropped it both read back without it and both round trip equal. What the sample asserts is mustNotAppear - that the bytes a writer produced do not carry the refused scheme. All five writers now degrade it to plain text and say so; the entry stays to keep it that way."
    },
    {
      "id": "links-relative",
      "title": "Targets that are not absolute",
      "exercises": [
        "link",
        "diagnostics"
      ],
      "lines": [
        "Root link here.",
        "Page link here.",
        "Anchor link here."
      ],
      "operations": [
        "inline:0:5-9:link=/docs/page",
        "inline:1:5-9:link=page.html",
        "inline:2:7-11:link=#anchor"
      ],
      "mustNotAppear": [
        {
          "text": "/docs/page",
          "emittedBy": [],
          "state": "accepted",
          "why": "A root-relative target has no scheme to check and nothing to resolve against - a document is not a page, and this component fetches nothing - so every writer refuses it and says so. Recorded here because the corpus's other link samples cover schemes only, and this was the half nobody had pinned.",
          "reviewer": "Claude Opus 5, on the write-side URI policy pass",
          "decided": "2026-09-05"
        },
        {
          "text": "page.html",
          "emittedBy": [],
          "state": "accepted",
          "why": "The same for a document-relative target. Both spellings are refused by all five writers, which is worth asserting because it is the case a reader of the conformance documents could mistake for a scheme question.",
          "reviewer": "Claude Opus 5, on the write-side URI policy pass",
          "decided": "2026-09-05"
        }
      ],
      "notes": "The three shapes a target can take that are not an absolute permitted URL. The two relative ones are refused by every writer, which mustNotAppear asserts against the bytes - the round trip cannot, because the writer that materialises the sample drops the link before any round trip begins. The anchor is admitted by every writer and round trips through all five, which it did not until one predicate replaced the five that disagreed about it. It is kept here because that agreement is the thing worth holding: a fragment preserves the reference the source made, and the six baseline rows it used to carry were the divergence going away."
    },
    {
      "id": "alignment",
      "title": "Paragraph alignment",
      "exercises": [
        "alignment"
      ],
      "lines": [
        "Left aligned line.",
        "Centred line.",
        "Right aligned line.",
        "Justified line."
      ],
      "operations": [
        "para:1:align=center",
        "para:2:align=right",
        "para:3:align=justify"
      ],
      "notes": "Includes justify, which is the alignment the conformance documents are least consistent about. This corpus records what the code does; where that differs from a document, the difference is a question for the document and the baseline says so in the row."
    },
    {
      "id": "lists",
      "title": "Bullet and numbered lists",
      "exercises": [
        "listKind",
        "indentLevel"
      ],
      "lines": [
        "Intro paragraph.",
        "Bullet one",
        "Bullet two",
        "Number one",
        "Number two",
        "After the lists."
      ],
      "operations": [
        "para:1-2:list=bullet",
        "para:3-4:list=numbered"
      ],
      "notes": "The paragraphs on either side are load-bearing: list state must not leak into the prose around it."
    },
    {
      "id": "indent-spacing",
      "title": "Indent levels and paragraph spacing",
      "exercises": [
        "indentLevel",
        "lineSpacing",
        "spacingBefore",
        "spacingAfter"
      ],
      "lines": [
        "Level zero.",
        "Level one.",
        "Level two.",
        "Spaced and stretched."
      ],
      "operations": [
        "para:1:indent=1",
        "para:2:indent=2",
        "para:3:before=12,after=12,linespacing=1.5"
      ],
      "notes": null
    },
    {
      "id": "unicode",
      "title": "Scripts, astral planes and symbols",
      "exercises": [
        "text",
        "encoding"
      ],
      "lines": [
        "Latin café naïve",
        "Cyrillic Привет",